question,text_answer,category
"What is your return policy?","You can return any item within 30 days of purchase for a full refund. The item must be unused and in its original packaging.","Returns"
"How do I track my order?","Once your order has shipped, you will receive an email with a tracking number. You can use this number on our website's 'Track Order' page.","Shipping"
"What are the shipping costs?","Standard shipping is free for all orders over $50. For orders under $50, the standard shipping fee is $5. Express shipping is available for a flat rate of $15.","Shipping"
"Do you ship internationally?","Yes, we ship to over 100 countries. International shipping costs and delivery times vary by destination. Please check our shipping page for more details.","Shipping"
"How can I contact customer service?","You can reach our customer service team via email at support@retail.com, or by calling our toll-free number 1-800-123-4567 during business hours.","Support"
"What payment methods do you accept?","We accept all major credit cards (Visa, MasterCard, American Express), PayPal, and Apple Pay.","Payments"
"Is my payment information secure?","Absolutely. We use industry-standard SSL encryption to protect your details. Your payment information is securely transmitted to our payment processor.","Payments"
"My order arrived damaged, what should I do?","We are so sorry to hear that! Please contact our customer service immediately with your order number and a photo of the damaged item. We will arrange for a replacement or a refund.","Returns"